{
  "contract_version": "1.0.0",
  "environment": "sandbox",
  "data_mode": "synthetic_demo",
  "suite_ref": "tv_local_stress_matrix_syntheticdemo2026",
  "scenarios": [
    {
      "scenario_id": "tv_local_stress_occupancy_total_exceeded_1",
      "corridor": "jerusalem_corridor",
      "trigger": "occupancy_total_exceeded",
      "disruption_type": "occupancy",
      "expected_strategy": "find_capacity_match",
      "expected_supplier_change_approval": true,
      "expected_financial_approval": false,
      "expected_safety_handoff": false,
      "expected_benefit_state": "not_applicable",
      "preserve_unaffected_components": true,
      "supplier_dispatched": false,
      "processor_called": false
    },
    {
      "scenario_id": "tv_local_stress_child_age_band_changed_2",
      "corridor": "eilat_corridor",
      "trigger": "child_age_band_changed",
      "disruption_type": "occupancy",
      "expected_strategy": "reallocate_party",
      "expected_supplier_change_approval": true,
      "expected_financial_approval": false,
      "expected_safety_handoff": false,
      "expected_benefit_state": "not_applicable",
      "preserve_unaffected_components": true,
      "supplier_dispatched": false,
      "processor_called": false
    },
    {
      "scenario_id": "tv_local_stress_room_allocation_invalid_3",
      "corridor": "jerusalem_corridor",
      "trigger": "room_allocation_invalid",
      "disruption_type": "occupancy",
      "expected_strategy": "reallocate_party",
      "expected_supplier_change_approval": true,
      "expected_financial_approval": false,
      "expected_safety_handoff": false,
      "expected_benefit_state": "not_applicable",
      "preserve_unaffected_components": true,
      "supplier_dispatched": false,
      "processor_called": false
    },
    {
      "scenario_id": "tv_local_stress_accessible_unit_unavailable_4",
      "corridor": "eilat_corridor",
      "trigger": "accessible_unit_unavailable",
      "disruption_type": "accessibility",
      "expected_strategy": "preserve_access_requirements",
      "expected_supplier_change_approval": true,
      "expected_financial_approval": false,
      "expected_safety_handoff": false,
      "expected_benefit_state": "not_applicable",
      "preserve_unaffected_components": true,
      "supplier_dispatched": false,
      "processor_called": false
    },
    {
      "scenario_id": "tv_local_stress_step_free_route_changed_5",
      "corridor": "jerusalem_corridor",
      "trigger": "step_free_route_changed",
      "disruption_type": "accessibility",
      "expected_strategy": "preserve_access_requirements",
      "expected_supplier_change_approval": true,
      "expected_financial_approval": false,
      "expected_safety_handoff": false,
      "expected_benefit_state": "not_applicable",
      "preserve_unaffected_components": true,
      "supplier_dispatched": false,
      "processor_called": false
    },
    {
      "scenario_id": "tv_local_stress_late_arrival_6",
      "corridor": "eilat_corridor",
      "trigger": "late_arrival",
      "disruption_type": "arrival",
      "expected_strategy": "reconfirm_arrival_and_keys",
      "expected_supplier_change_approval": false,
      "expected_financial_approval": false,
      "expected_safety_handoff": false,
      "expected_benefit_state": "not_applicable",
      "preserve_unaffected_components": true,
      "supplier_dispatched": false,
      "processor_called": false
    },
    {
      "scenario_id": "tv_local_stress_key_handoff_failed_7",
      "corridor": "jerusalem_corridor",
      "trigger": "key_handoff_failed",
      "disruption_type": "arrival",
      "expected_strategy": "reconfirm_arrival_and_keys",
      "expected_supplier_change_approval": true,
      "expected_financial_approval": false,
      "expected_safety_handoff": false,
      "expected_benefit_state": "not_applicable",
      "preserve_unaffected_components": true,
      "supplier_dispatched": false,
      "processor_called": false
    },
    {
      "scenario_id": "tv_local_stress_check_in_window_changed_8",
      "corridor": "eilat_corridor",
      "trigger": "check_in_window_changed",
      "disruption_type": "arrival",
      "expected_strategy": "reconfirm_arrival_and_keys",
      "expected_supplier_change_approval": true,
      "expected_financial_approval": false,
      "expected_safety_handoff": false,
      "expected_benefit_state": "not_applicable",
      "preserve_unaffected_components": true,
      "supplier_dispatched": false,
      "processor_called": false
    },
    {
      "scenario_id": "tv_local_stress_check_out_window_changed_9",
      "corridor": "jerusalem_corridor",
      "trigger": "check_out_window_changed",
      "disruption_type": "arrival",
      "expected_strategy": "reconfirm_arrival_and_keys",
      "expected_supplier_change_approval": true,
      "expected_financial_approval": false,
      "expected_safety_handoff": false,
      "expected_benefit_state": "not_applicable",
      "preserve_unaffected_components": true,
      "supplier_dispatched": false,
      "processor_called": false
    },
    {
      "scenario_id": "tv_local_stress_vat_eligibility_changed_10",
      "corridor": "eilat_corridor",
      "trigger": "vat_eligibility_changed",
      "disruption_type": "commercial_terms",
      "expected_strategy": "revalidate_local_terms",
      "expected_supplier_change_approval": false,
      "expected_financial_approval": true,
      "expected_safety_handoff": false,
      "expected_benefit_state": "not_applicable",
      "preserve_unaffected_components": true,
      "supplier_dispatched": false,
      "processor_called": false
    },
    {
      "scenario_id": "tv_local_stress_deposit_terms_changed_11",
      "corridor": "jerusalem_corridor",
      "trigger": "deposit_terms_changed",
      "disruption_type": "commercial_terms",
      "expected_strategy": "revalidate_local_terms",
      "expected_supplier_change_approval": false,
      "expected_financial_approval": true,
      "expected_safety_handoff": false,
      "expected_benefit_state": "not_applicable",
      "preserve_unaffected_components": true,
      "supplier_dispatched": false,
      "processor_called": false
    },
    {
      "scenario_id": "tv_local_stress_cancellation_deadline_near_12",
      "corridor": "eilat_corridor",
      "trigger": "cancellation_deadline_near",
      "disruption_type": "commercial_terms",
      "expected_strategy": "protect_deadline",
      "expected_supplier_change_approval": false,
      "expected_financial_approval": false,
      "expected_safety_handoff": false,
      "expected_benefit_state": "not_applicable",
      "preserve_unaffected_components": true,
      "supplier_dispatched": false,
      "processor_called": false
    },
    {
      "scenario_id": "tv_local_stress_shabbat_check_in_conflict_13",
      "corridor": "jerusalem_corridor",
      "trigger": "shabbat_check_in_conflict",
      "disruption_type": "shabbat",
      "expected_strategy": "revalidate_shabbat_fit",
      "expected_supplier_change_approval": true,
      "expected_financial_approval": false,
      "expected_safety_handoff": false,
      "expected_benefit_state": "not_applicable",
      "preserve_unaffected_components": true,
      "supplier_dispatched": false,
      "processor_called": false
    },
    {
      "scenario_id": "tv_local_stress_shabbat_key_conflict_14",
      "corridor": "eilat_corridor",
      "trigger": "shabbat_key_conflict",
      "disruption_type": "shabbat",
      "expected_strategy": "revalidate_shabbat_fit",
      "expected_supplier_change_approval": true,
      "expected_financial_approval": false,
      "expected_safety_handoff": false,
      "expected_benefit_state": "not_applicable",
      "preserve_unaffected_components": true,
      "supplier_dispatched": false,
      "processor_called": false
    },
    {
      "scenario_id": "tv_local_stress_kosher_certificate_expired_15",
      "corridor": "jerusalem_corridor",
      "trigger": "kosher_certificate_expired",
      "disruption_type": "certificate_expiry",
      "expected_strategy": "revalidate_kosher_evidence",
      "expected_supplier_change_approval": true,
      "expected_financial_approval": false,
      "expected_safety_handoff": false,
      "expected_benefit_state": "not_applicable",
      "preserve_unaffected_components": true,
      "supplier_dispatched": false,
      "processor_called": false
    },
    {
      "scenario_id": "tv_local_stress_kosher_scope_conflict_16",
      "corridor": "eilat_corridor",
      "trigger": "kosher_scope_conflict",
      "disruption_type": "certificate_expiry",
      "expected_strategy": "revalidate_kosher_evidence",
      "expected_supplier_change_approval": true,
      "expected_financial_approval": false,
      "expected_safety_handoff": false,
      "expected_benefit_state": "not_applicable",
      "preserve_unaffected_components": true,
      "supplier_dispatched": false,
      "processor_called": false
    },
    {
      "scenario_id": "tv_local_stress_rail_service_disrupted_17",
      "corridor": "jerusalem_corridor",
      "trigger": "rail_service_disrupted",
      "disruption_type": "rail",
      "expected_strategy": "reroute_local_transport",
      "expected_supplier_change_approval": true,
      "expected_financial_approval": false,
      "expected_safety_handoff": false,
      "expected_benefit_state": "not_applicable",
      "preserve_unaffected_components": true,
      "supplier_dispatched": false,
      "processor_called": false
    },
    {
      "scenario_id": "tv_local_stress_road_corridor_closed_18",
      "corridor": "eilat_corridor",
      "trigger": "road_corridor_closed",
      "disruption_type": "road",
      "expected_strategy": "reroute_local_transport",
      "expected_supplier_change_approval": true,
      "expected_financial_approval": false,
      "expected_safety_handoff": false,
      "expected_benefit_state": "not_applicable",